sstb_id,zuco_id,content,control_id,sstb_label,BERT_MC_DROPOUT
5211,251,"in addition to scoring high for originality of plot -- putting together familiar themes of family, forgiveness and love in a new way -- lilo & stitch has a number of other assets to commend it to movie audiences both innocent and jaded.",,1,1.1809922227500684
5213,319,one of the most exciting action films to come out of china in recent years.,,1,0.34604083135189234
5304,119,"elegantly produced and expressively performed, the six musical numbers crystallize key plot moments into minutely detailed wonders of dreamlike ecstasy.",,1,0.665103647171853
5310,298,"a breathtaking adventure for all ages, spirit tells its poignant and uplifting story in a stunning fusion of music and images.",,1,0.2567412691463224
5313,65,... something appears to have been lost in the translation this time.,,-1,1.1598786866255704
5401,123,that haynes can both maintain and dismantle the facades that his genre and his character construct is a wonderous accomplishment of veracity and narrative grace.,,1,0.9709707071434002
5424,133,"it's like an old warner bros. costumer jived with sex -- this could be the movie errol flynn always wanted to make, though bette davis, cast as joan, would have killed him.",,0,1.1136100220812981
5425,131,it's a great american adventure and a wonderful film to bring to imax.,,1,0.15505416206223746
5455,287,even more baffling is that it's funny.,,0,1.0769434928999981
5565,249,"the wonderful combination of the sweetness and the extraordinary technical accomplishments of the first film are maintained, but its overall impact falls a little flat with a storyline that never quite delivers the original magic.",,0,1.3588196180111243
5596,331,"if borstal boy isn't especially realistic, it is an engaging nostalgia piece.",,0,1.1748773795986414
5603,29,another best of the year selection.,,1,0.8569873134749142
5626,233,it will guarantee to have you leaving the theater with a smile on your face.,32.0,1,0.9378342078623848
5679,151,mazel tov to a film about a family's joyous life acting on the yiddish stage.,,1,1.1823038484368737
5706,361,"as a remake, it's a pale imitation.",,-1,0.8535768975083048
5838,220,"it never is, not fully.",,0,0.7331799268238429
5849,377,it just doesn't have much else... especially in a moral sense.,,0,1.4081996206921557
5860,142,exactly what you'd expect from a guy named kaos.,,0,0.8304858188728605
5923,288,"parker should be commended for taking a fresh approach to familiar material, but his determination to remain true to the original text leads him to adopt a somewhat mannered tone... that ultimately dulls the human tragedy at the story's core.",,0,1.553715345465734
5998,388,"... jones, despite a definitely distinctive screen presence, just isn't able to muster for a movie that, its title notwithstanding, should have been a lot nastier if it wanted to fully capitalize on its lead's specific gifts.",,0,1.5102804390597282
6029,33,"that's not vintage spielberg and that, finally, is minimally satisfying.",,0,1.4845473629417296
6075,327,"if you already like this sort of thing, this is that sort of thing all over again.",,0,1.1087877145424303
6086,266,"labute can't avoid a fatal mistake in the modern era: he's changed the male academic from a lower-class brit to an american, a choice that upsets the novel's exquisite balance and shreds the fabric of the film.",,0,0.8517527635219284
6091,320,adam sandler's eight crazy nights grows on you -- like a rash.,,-1,1.020378742996522
6132,213,the cumulative effect of the movie is repulsive and depressing.,,-1,0.46630150578554536
6138,355,"peralta's mythmaking could have used some informed, adult hindsight.",,0,1.2224064189997617
6147,150,mr. soderbergh's direction and visual style struck me as unusually and unimpressively fussy and pretentious.,,-1,0.6622127477978373
6173,86,... a bland murder-on-campus yawner.,,-1,1.256667340852118
6208,258,"although the sequel has all the outward elements of the original, the first film's lovely flakiness is gone, replaced by the forced funniness found in the dullest kiddie flicks.",,-1,1.4304314740038893
6226,279,"circuit queens won't learn a thing, they'll be too busy cursing the film's strategically placed white sheets.",,0,0.7823952561166732
6252,379,"viewed as a comedy, a romance, a fairy tale, or a drama, there's nothing remotely triumphant about this motion picture.",,0,1.5612039860322533
6285,99,reeks of rot and hack work from start to finish.,,0,0.5107675341747991
6291,387,"the art direction is often exquisite, and the anthropomorphic animal characters are beautifully realized through clever makeup design, leaving one to hope that the eventual dvd release will offer subtitles and the original italian-language soundtrack.",,1,0.522347126057392
6302,165,kirshner and monroe seem to be in a contest to see who can out-bad-act the other.,,-1,1.1627078012322636
6304,104,a lame romantic comedy about an unsympathetic character and someone who would not likely be so stupid as to get involved with her.,,-1,0.8249283714928798
6331,234,"the misery of these people becomes just another voyeuristic spectacle, to be consumed and forgotten.",,-1,0.39220441449648746
6406,264,"the emperor's club is one of those films that possesses all the good intentions in the world, but...",,0,1.2354427039351625
6430,352,"we never truly come to care about the main characters and whether or not they'll wind up together, and michele's spiritual quest is neither amusing nor dramatic enough to sustain interest.",,-1,1.4745844079772472
6534,45,crush could be the worst film a man has made about women since valley of the dolls.,,-1,0.36644579895483576
6543,58,"i did go back and check out the last 10 minutes, but these were more repulsive than the first 30 or 40 minutes.",,-1,1.4561119234307238
6558,321,"the film feels formulaic, its plot and pacing typical hollywood war-movie stuff, while the performances elicit more of a sense of deja vu than awe.",,-1,1.5424860822429487
6575,301,a movie so bad that it quickly enters the pantheon of wreckage that includes battlefield earth and showgirls.,,-1,0.35528464086179207
6600,74,"it is supremely unfunny and unentertaining to watch middle-age and older men drink to excess, piss on trees, b.s. one another and put on a show in drag.",11.0,-1,0.4942805033411614
6684,280,"a lot of talent is wasted in this crass, low-wattage endeavor.",36.0,-1,0.7244753689157236
6725,126,"i was feeling this movie until it veered off too far into the exxon zone, and left me behind at the station looking for a return ticket to realism.",,-1,1.288598413733236
6747,314,"it's a bizarre curiosity memorable mainly for the way it fritters away its potentially interesting subject matter via a banal script, unimpressive acting and indifferent direction.",,0,1.4070880968196293
6756,210,the movie slides downhill as soon as macho action conventions assert themselves.,,-1,1.235630165024603
6773,87,in comparison to his earlier films it seems a disappointingly thin slice of lower-class london life; despite the title... amounts to surprisingly little.,,-1,0.6120049496225406
6792,137,anemic chronicle of money grubbing new yorkers and their serial loveless hook ups.,,0,1.3405953044297958
6825,124,"some elements of it really blow the big one, but other parts are decent.",,0,1.274133296934467
6844,304,"the doofus-on-the-loose banter of welcome to collinwood has a cocky, after-hours loopiness to it.",,0,1.462315681612647
6964,254,bad and baffling from the get-go.,,-1,0.337823478795836
6972,292,both the crime story and the love story are unusual.,,0,1.3847411871144686
6983,81,"since lee is a sentimentalist, the film is more worshipful than your random e!",,0,1.3612008897949708
7124,274,"the director, with his fake backdrops and stately pacing, never settles on a consistent tone.",,-1,1.1601039838982006
7132,240,"after seeing the film, i can tell you that there's no other reason why anyone should bother remembering it.",,-1,1.246118011039519
7216,256,the original wasn't a good movie but this remake makes it look like a masterpiece!,,-1,1.3993401064156088
7218,270,gere gives a good performance in a film that doesn't merit it.,,0,1.4133799101187943
7221,25,"there's no palpable chemistry between lopez and male lead ralph fiennes, plus the script by working girl scribe kevin wade is workmanlike in the extreme.",,-1,1.4920239647226885
7291,85,this thing works on no level whatsoever for me.,,-1,1.0652184896861008
7308,118,feels less like a cousin to blade runner than like a bottom-feeder sequel in the escape from new york series.,,-1,1.3446318232368715
7452,101,"the movie is what happens when you blow up small potatoes to 10 times their natural size, and it ain't pretty.",,-1,0.5994794531602022
7464,90,"the twist that ends the movie is the one with the most emotional resonance, but twists are getting irritating, and this is the kind of material where the filmmakers should be very careful about raising eyebrows.",,0,1.1890525336480557
7495,136,"it's as if you're watching a movie that was made in 1978 but not released then because it was so weak, and it has been unearthed and released now, when it has become even weaker.",,-1,0.5562599550244021
7513,253,"at its worst, it implodes in a series of very bad special effects.",,-1,0.23868704640669736
7529,73,if only the story about a multi-million dollar con bothered to include the con.,,0,1.2660368696797986
7535,257,"to my taste, the film's comic characters come perilously close to being amoses and andys for a new generation.",,0,1.463947796969335
7542,215,"a very long movie, dull in stretches, with entirely too much focus on meal preparation and igloo construction.",,-1,1.2177962520607333
7616,223,"with the exception of some fleetingly amusing improvisations by cedric the entertainer as perry's boss, there isn't a redeeming moment here.",,-1,1.55182886776842
7638,296,"if you're a wwf fan, or you related to the people who watched the robots getting butchered in a.i., you'll probably like rollerball.",,0,1.115480505392082
7699,172,the only entertainment you'll derive from this choppy and sloppy affair will be from unintentional giggles -- several of them.,,-1,1.3134941063241836
7706,269,... think of it as american pie on valium.,,0,0.33572982649772626
7709,44,"... a plotline that's as lumpy as two-day old porridge... the filmmakers' paws, sad to say, were all over this ``un-bear-able'' project!",8.0,-1,0.5531875279624008
7733,161,there are plot holes big enough for shamu the killer whale to swim through.,,-1,0.6146479360053375
7741,156,it's everything you don't go to the movies for.,,-1,0.4791631853346578
7757,111,"instead of hiding pinocchio from critics, miramax should have hidden it from everyone.",,-1,1.0391196924610424
7898,192,even horror fans will most likely not find what they're seeking with trouble every day; the movie lacks both thrills and humor.,,-1,1.1391100617073775
7908,222,it should be mentioned that the set design and interiors of the haunted vessel are more than effectively creepy and moodily lit.,,1,1.5320252375042183
7912,56,the film seems a dead weight.,,-1,0.6565167253969239
7937,337,to say analyze that is de niro's best film since meet the parents sums up the sad state of his recent career.,,0,1.3712651425408113
7988,20,"for the most part, the ingredients are there.",,0,0.3877443024203368
8001,181,"after that, it just gets stupid and maudlin.",,-1,0.5020751010435656
8032,228,the movie is virtually without context -- journalistic or historical.,,-1,1.0546646883245792
8056,48,the movie will reach far beyond its core demographic.,,1,0.7512559053688022
8089,313,"that is essentially what's missing from blackboards -- the sense of something bigger, some ultimate point.",,0,1.150341904669926
8123,300,largely a for-fans artifact.,,0,0.8236104684393181
8144,310,"i didn't laugh at the ongoing efforts of cube, and his skinny buddy mike epps, to make like laurel and hardy'n the hood.",,-1,1.5261358636080724
8239,356,"``my god, i'm behaving like an idiot!''",,0,0.5459647725741154
8254,275,"why he was given free reign over this project -- he wrote, directed, starred and produced -- is beyond me.",,-1,1.1697525545769059
8292,117,better at putting you to sleep than a sound machine.,,-1,0.9424877144294307
8301,43,bullock's complete lack of focus and ability quickly derails the film.1,,-1,0.8294895233764124
8367,49,how did it ever get made?,,-1,0.28706110106500077
8380,293,it's never a good sign when a film's star spends the entirety of the film in a coma.,37.0,-1,0.45718070686667533
8457,205,"as written by michael berg and michael j. wilson from a story by wilson, this relentless, all-wise-guys-all-the-time approach tries way too hard and gets tiring in no time at all.",,-1,1.070854361154875
8480,385,"too much of this well-acted but dangerously slow thriller feels like a preamble to a bigger, more complicated story, one that never materializes.",,-1,1.3941177672308342
8508,47,flaccid drama and exasperatingly slow journey.,,-1,1.0716503828543935
8510,89,"suffers from rambling, repetitive dialogue and the visual drabness endemic to digital video.",,-1,0.331160462442615
8585,62,"but here's the real damn: it isn't funny, either.",,-1,0.4485485106589065
8610,23,"the acting is stiff, the story lacks all trace of wit, the sets look like they were borrowed from gilligan's island -- and the cgi scooby might well be the worst special-effects creation of the year.",,-1,0.40809445055331767
8649,149,aaliyah rarely dampens her diva persona enough to spark genuine chemistry with townsend.,,0,1.4503339942923368
8681,186,"it's badly acted, blandly directed, and could have been scripted by someone who just graduated from elementary school.",,-1,0.5818525643123085
8720,398,the sort of movie that gives tastelessness a bad rap.,,-1,0.4895970287972027
8770,75,"only a few minutes elapse before the daddy of all slashers arrives, still with the boiler suit and white mask, which look remarkably clean for a guy who has been mass-murdering since 1978 but has never been seen doing laundry.",,0,1.4337705171703905
8801,315,"while obviously an extremely personal work, it remains inextricably stuck in an emotionally unavailable rut.",,0,0.5109893487987495
8863,271,"the movie is as far as you can get from racy, to the point where it almost stops the blood flow to your brain; it has a dull, costumey feel.",34.0,-1,0.7336470317035864
8919,72,`how many more voyages can this limping but dearly-loved franchise survive?',,0,1.2575932954443634
8921,400,"fans of the tv series will be disappointed, and everyone else will be slightly bored.",44.0,0,0.37209740683616394
8954,76,"showtime is one of the hapless victims of the arrogant ``if we put together a wry white man and a chatty black man and give them guns, the movie will be funny'' syndrome.",,-1,1.4468329434687226
8974,52,could the country bears really be as bad as its trailers?,,-1,0.5965299077022423
9027,169,an atonal estrogen opera that demonizes feminism while gifting the most sympathetic male of the piece with a nice vomit bath at his wedding.,,-1,1.3431853631517898
9033,59,"a lousy movie that's not merely unwatchable, but also unlistenable.",,-1,0.9687818839458692
9049,66,"like a documentary version of fight club, shorn of social insight, intellectual pretension and cinematic interest.",,0,1.3964979211274502
9066,55,"the stupidest, most insulting movie of 2002's first quarter.",9.0,-1,0.2982432195436184
9080,322,"... pitiful, slapdash disaster.",,-1,0.24373514566831658
9104,371,"a gratingly unfunny groaner littered with zero-dimensional, unlikable characters and hackneyed, threadbare comic setups.",,-1,0.39540643048591395
9119,227,"you come away wishing, though, that the movie spent a lot less time trying to make a credible case for reports from the afterlife and a lot more time on the romantic urgency that's at the center of the story.",,0,1.3794472171556096
9188,148,"cox offers plenty of glimpses at existing photos, but there are no movies of nijinsky, so instead the director treats us to an aimless hodgepodge.",,-1,1.0625206838333414
9282,323,"as it stands, there's some fine sex onscreen, and some tense arguing, but not a whole lot more.",,0,1.295268158907672
9284,395,the picture doesn't know it's a comedy.,,0,0.6227444492513313
9285,130,"a stupid, derivative horror film that substitutes extreme gore for suspense.",16.0,-1,0.643398017776097
9325,188,"despite its raucous intent, xxx is as conventional as a nike ad and as rebellious as spring break.",,0,1.4531772114764008
9330,369,"an amateurish, quasi-improvised acting exercise shot on ugly digital video.",39.0,-1,1.2031687836395497
9348,364,a generic family comedy unlikely to be appreciated by anyone outside the under-10 set.,,-1,1.4429002161914428
9355,374,"a profoundly stupid affair, populating its hackneyed and meanspirited storyline with cardboard characters and performers who value cash above credibility.",,-1,1.063537015308615
9366,317,"the good is very, very good... the rest runs from mildly unimpressive to despairingly awful.",,0,1.2897419263788228
9396,152,... would be a total loss if not for two supporting performances taking place at the movie's edges.,,0,0.7596655990220172
9429,144,"for those for whom the name woody allen was once a guarantee of something fresh, sometimes funny, and usually genuinely worthwhile, hollywood ending is a depressing experience.",,-1,1.399743577714533
9435,338,"like being trapped inside a huge video game, where exciting, inane images keep popping past your head and the same illogical things keep happening over and over again.",,0,0.9613776008695981
9439,70,everything was as superficial as the forced new jersey lowbrow accent uma had.,,-1,0.8951360751326752
9453,183,"plods along, minus the twisted humor and eye-popping visuals that have made miike... a cult hero.",,0,1.5149081482291447
9491,229,"after sitting through this sloppy, made-for-movie comedy special, it makes me wonder if lawrence hates criticism so much that he refuses to evaluate his own work.",,-1,0.42123151732212416
9500,154,"loud, chaotic and largely unfunny.",,-1,0.6076319897547147
9506,7,"bread, my sweet has so many flaws it would be easy for critics to shred it.",,-1,1.1591653025897914
9509,16,"frida is certainly no disaster, but neither is it the kahlo movie frida fans have been looking for.",,0,1.4253337362496648
9516,276,"if you enjoy being rewarded by a script that assumes you aren't very bright, then blood work is for you.",,-1,1.219884981355462
9518,15,the film's stagecrafts are intimate and therefore bolder than the otherwise calculated artifice that defines and overwhelms the film's production design.,,0,1.3504667646240194
9599,36,"for the rest of us, sitting through dahmer's two hours amounts to little more than punishment.",,-1,1.0647485470926181
9600,246,narc can only remind us of brilliant crime dramas without becoming one itself.,,0,1.2833503631421574
9620,302,"if you're over 25, have an iq over 90, and have a driver's license, you should be able to find better entertainment.",,-1,0.9922074688372415
9642,235,"a thoroughly awful movie -- dumb, narratively chaotic, visually sloppy... a weird amalgam of `the thing' and a geriatric `scream.'",,-1,0.2990560525472587
9644,200,"nothing sticks, really, except a lingering creepiness one feels from being dragged through a sad, sordid universe of guns, drugs, avarice and damaged dreams.",,-1,0.25396288942163375
9703,207,this is one of the biggest disappointments of the year.,30.0,-1,0.26167392505354997
9725,53,"at times, the movie looks genuinely pretty.",,1,0.6904168706434327
9730,132,it's 51 times better than this.,,0,0.6694174450077821
9731,219,"it's difficult to conceive of anyone who has reached puberty actually finding the characters in slackers or their antics amusing, let alone funny.",,-1,1.4760366294811327
9760,5,presents a good case while failing to provide a reason for us to care beyond the very basic dictums of human decency.,,0,1.4116108965720193
9768,365,"an amalgam of the fugitive, blade runner, and total recall, only without much energy or tension.",,0,1.0118396323985328
9824,145,bella is the picture of health with boundless energy until a few days before she dies.,,0,1.4500696569579608
9830,340,the rock has a great presence but one battle after another is not the same as one battle followed by killer cgi effects.,,0,1.2515706349937987
9852,147,what should have been a cutting hollywood satire is instead about as fresh as last week's issue of variety.,,-1,1.4590660694245943
9857,19,"the movie's plot is almost entirely witless and inane, carrying every gag two or three times beyond its limit to sustain a laugh.",,-1,1.2075945851768533
9885,196,"a loud, ugly, irritating movie without any of its satirical salvos hitting a discernible target.",28.0,-1,0.5118487891007736
9902,368,"co-writer/director jonathan parker's attempts to fashion a brazil-like, hyper-real satire fall dreadfully short.",,-1,0.733666293760483
9917,105,"rob schneider's infantile cross-dressing routines fill the hot chick, the latest gimmick from this unimaginative comedian.",,-1,1.377949764214547
9920,27,the film is so bad it doesn't improve upon the experience of staring at a blank screen.,5.0,-1,0.2788419641889417
9982,96,deserves high marks for political courage but barely gets by on its artistic merits.,,0,1.453318753198061
10011,382,"thanks largely to williams, all the interesting developments are processed in 60 minutes -- the rest is just an overexposed waste of film.",,-1,1.2851240202205056
10023,64,it's a fanboy `what if?',,0,0.4723181898389926
10032,236,"one of those staggeringly well-produced, joylessly extravagant pictures that keep whooshing you from one visual marvel to the next, hastily, emptily.",,0,1.3242290914083894
10035,305,it's the funniest american comedy since graffiti bridge.,,1,0.7270128009465535
10041,163,"stitch is a bad mannered, ugly and destructive little ****.",,-1,0.2012147140126111
10061,231,"for all the complications, it's all surprisingly predictable.",,0,1.4606753110887176
10064,278,but his showboating wise-cracker stock persona sure is getting old.,,0,1.34628500646829
10065,14,"if deuces wild had been tweaked up a notch it would have become a camp adventure, one of those movies that's so bad it starts to become good.",,0,1.328609661508516
10098,349,distinctly sub-par... more likely to drown a viewer in boredom than to send any shivers down his spine.,,-1,1.1452451988116066
10176,402,"bray is completely at sea; with nothing but a savage garden music video on his resume, he has no clue about making a movie.",,-1,1.0199610831289019
10223,350,godard's ode to tackling life's wonderment is a rambling and incoherent manifesto about the vagueness of topical excess... in praise of love remains a ponderous and pretentious endeavor that's unfocused and tediously exasperating.,,-1,1.2968156588001356
10256,376,it isn't that stealing harvard is a horrible movie -- if only it were that grand a failure!,,-1,0.3681854464639758
10267,167,"like life on the island, the movie grows boring despite the scenery.",22.0,-1,0.5647116124444277
10283,122,"apparently, romantic comedy with a fresh point of view just doesn't figure in the present hollywood program.",,-1,1.3901581246686945
10357,143,"if legendary shlockmeister ed wood had ever made a movie about a vampire, it probably would look a lot like this alarming production, adapted from anne rice's novel the vampire chronicles.",19.0,0,1.4334813283429648
10394,170,"even by the intentionally low standards of frat-boy humor, sorority boys is a bowser.",,-1,1.378001960949084
10507,51,"it briefly flirts with player masochism, but the point of real interest -- audience sadism -- is evaded completely.",,0,1.202609926015571
10544,343,"the problem is that for the most part, the film is deadly dull.",,-1,0.4503527376534455
10558,290,"i have no problem with ``difficult'' movies, or movies that ask the audience to meet them halfway and connect the dots instead of having things all spelled out.",,0,1.5192295562973746
10598,217,i'm not sure which will take longer to heal: the welt on johnny knoxville's stomach from a riot-control projectile or my own tortured psyche.,,-1,1.025508469523807
10599,218,"while serving sara does have a long way to go before it reaches the level of crudity in the latest austin powers extravaganza, there's nothing here to match that movie's intermittent moments of inspiration.",,0,1.459354656312742
10613,378,those unfamiliar with mormon traditions may find the singles ward occasionally bewildering.,,0,1.4220997744828403
10629,394,"feels slight, as if it were an extended short, albeit one made by the smartest kids in class.",,0,1.3684117783803467
10637,94,"even as i valiantly struggled to remain interested, or at least conscious, i could feel my eyelids... getting... very... heavy...",13.0,-1,0.9814386891621413
10693,335,... about as exciting to watch as two last-place basketball teams playing one another on the final day of the season.,,-1,0.8064923472683393
10739,341,visually sumptuous but intellectually stultifying.,,0,1.5284725918853452
10758,102,"even a hardened voyeur would require the patience of job to get through this interminable, shapeless documentary about the swinging subculture.",,-1,1.3929125128135877
10774,193,after that it becomes long and tedious like a classroom play in a college history course.,27.0,-1,1.4769895853495636
10799,71,"despite the holes in the story and the somewhat predictable plot, moments of the movie caused me to jump in my chair...",,0,1.4524715666599106
10816,239,"in a strange way, egoyan has done too much.",,0,0.9727067000212093
10833,11,the film rehashes several old themes and is capped with pointless extremes -- it's insanely violent and very graphic.,,-1,0.5059835357714111
10839,28,weiss and speck never make a convincing case for the relevance of these two 20th-century footnotes.,,0,1.4158483771066281
