sstb_id,zuco_id,content,control_id,sstb_label,BERT_MC_DROPOUT
10893,397,"starts out mediocre, spirals downward, and thuds to the bottom of the pool with an utterly incompetent conclusion.",43.0,-1,0.5121869499880326
10918,214,"feels like nothing quite so much as a middle-aged moviemaker's attempt to surround himself with beautiful, half-naked women.",,0,1.4496340249033253
10920,392,"this picture is murder by numbers, and as easy to be bored by as your abc's, despite a few whopping shootouts.",,-1,1.4657634178144936
10966,175,attal pushes too hard to make this a comedy or serious drama.,,-1,0.8108545152248235
10997,8,"slow, silly and unintentionally hilarious.",1.0,0,1.4912753242434826
11002,283,this stuck pig of a movie flails limply between bizarre comedy and pallid horror.,,-1,0.8948650304749155
11010,125,"no french people were harmed during the making of this movie, but they were insulted and the audience was put through torture for an hour and a half.",,-1,0.5441703485906755
11063,362,adults will certainly want to spend their time in the theater thinking up grocery lists and ways to tell their kids how not to act like pinocchio.,,0,0.979446528125872
11141,42,"this hastily mounted production exists only to capitalize on hopkins' inclination to play hannibal lecter again, even though harris has no immediate inclination to provide a fourth book.",,-1,1.1292759217483914
11191,82,"the movie is almost completely lacking in suspense, surprise and consistent emotional conviction.",,-1,1.3965178711149502
11192,140,festers in just such a dungpile that you'd swear you were watching monkeys flinging their feces at you.,,-1,1.231731490312194
11255,404,men in black ii achieves ultimate insignificance -- it's the sci-fi comedy spectacle as whiffle-ball epic.,,-1,1.290371640854957
11257,78,"a zombie movie in every sense of the word -- mindless, lifeless, meandering, loud, painful, obnoxious.",,-1,0.4429305683814847
11314,187,"the sort of picture in which, whenever one of the characters has some serious soul searching to do, they go to a picture-perfect beach during sunset.",,-1,1.0122005379913683
11315,330,"aptly named, this shimmering, beautifully costumed and filmed production doesn't work for me.",,0,1.4792674955602414
11318,366,"everything its title implies, a standard-issue crime drama spat out from the tinseltown assembly line.",,0,1.03197028767335
11327,112,what a great shame that such a talented director as chen kaige has chosen to make his english-language debut with a film so poorly plotted and scripted.,,-1,1.3281066982460676
11353,316,"a dim-witted and lazy spin-off of the animal planet documentary series, crocodile hunter is entertainment opportunism at its most glaring.",,-1,1.26718330603045
11358,403,"it's not a particularly good film, but neither is it a monsterous one.",46.0,0,0.5719863495889363
11376,157,"harris is supposed to be the star of the story, but comes across as pretty dull and wooden.",,0,1.0139735071391132
11399,245,"some movies can get by without being funny simply by structuring the scenes as if they were jokes: a setup, delivery and payoff.",,0,1.2897175048424003
11411,328,an awful movie that will only satisfy the most emotionally malleable of filmgoers.,,-1,0.6594106344673296
11439,195,"blade ii has a brilliant director and charismatic star, but it suffers from rampant vampire devaluation.",,0,1.3097353394982516
11504,326,"the venezuelans say things like ``si, pretty much'' and ``por favor, go home'' when talking to americans.",,0,0.5887111034417292
11563,174,"a bittersweet contemporary comedy about benevolent deception, which, while it may not rival the filmmaker's period pieces, is still very much worth seeing.",,1,1.3153970083646551
11604,370,"``the kid stays in the picture'' is a great story, terrifically told by the man who wrote it but this cliff notes edition is a cheat.",,0,1.2755595490580722
11627,345,an exhilarating experience.,,1,0.42142237506891916
11661,46,"reassuring, retro uplifter.",,1,0.5681055610722171
11783,141,under-rehearsed and lifeless,18.0,-1,0.414965286442275
