sstb_id,zuco_id,content,control_id,sstb_label,BERT_MC_DROPOUT
38,383,"cantet perfectly captures the hotel lobbies, two-lane highways, and roadside cafes that permeate vincent's days",,1,1.0370412821253654
81,359,gollum's `performance' is incredible!,,1,0.29505259740481155
86,206,"it's the best film of the year so far, the benchmark against which all other best picture contenders should be measured.",,1,0.3545537145956251
94,255,"the movie is a blast of educational energy, as bouncy animation and catchy songs escort you through the entire 85 minutes.",,1,0.5677937135305401
105,189,... a roller-coaster ride of a movie,25.0,1,0.44177321113250345
139,396,a classy item by a legend who may have nothing left to prove but still has the chops and drive to show how its done.,,1,1.1842706420321407
155,93,it is intensely personal and yet -- unlike quills -- deftly shows us the temper of the times.,,1,1.4187317522396685
219,299,it won't bust your gut -- and it's not intended to -- it's merely a blandly cinematic surgical examination of what makes a joke a joke.,,0,1.4209041510940421
252,347,remarkably accessible and affecting.,,1,0.4418325021513884
262,50,i like the new footage and still love the old stuff.,,1,0.2898037513939727
290,381,it's solid and affecting and exactly as thought-provoking as it should be.,41.0,1,0.7324139160969
342,178,this bold and lyrical first feature from raja amari expands the pat notion that middle-aged women just wanna have fun into a rousing treatise of sensual empowerment.,,1,0.8836637144328954
344,336,girls gone wild and gone civil again,,0,1.023419654237753
349,162,... always remains movingly genuine.,21.0,1,1.0473790732774033
371,69,an intriguing and entertaining introduction to johnson.,,1,0.20081362897296767
384,121,"celebrated at sundance, this slight comedy of manners has winning performances and a glossy, glib charm that's hard to beat.",,1,1.4484612752070918
406,308,"often gruelling and heartbreaking to witness, but seldahl and wollter's sterling performances raise this far above the level of the usual maudlin disease movie.",,1,1.3234223207931919
408,182,"the stunning, dreamlike visuals will impress even those viewers who have little patience for euro-film pretension.",24.0,1,0.9464741862851052
456,153,an inspiring and heart-affecting film about the desperate attempts of vietnamese refugees living in u.s. relocation camps to keep their hopes alive in 1975.,,1,1.0166195462139629
478,109,"only an epic documentary could get it all down, and spike lee's jim brown: all american at long last gives its subject a movie worthy of his talents.",14.0,1,1.222891066109893
677,312,ford deserves to be remembered at oscar time for crafting this wonderful portrait of a conflicted soldier.,,1,0.7448726832907036
726,18,a work of astonishing delicacy and force.,3.0,1,0.7908408081525931
768,363,"not as distinctive or even as humorous as its needs to be to stand out, but it has clearly been made with affection and care.",,0,1.346756410914305
793,342,"so young, so smart, such talent, such a wise ***.",,1,0.8326612274236243
840,225,"``13 conversations'' holds its goodwill close, but is relatively slow to come to the point.",,0,1.4094542341301999
882,17,the film often achieves a mesmerizing poetry.,2.0,1,1.1018507083285536
884,324,it's neither as romantic nor as thrilling as it should be.,38.0,-1,1.5519903594775801
904,386,a richly imagined and admirably mature work from a gifted director who definitely has something on his mind.,,1,0.31675418520827237
907,208,it never fails to engage us.,,1,1.4581456182771764
944,160,"there is a refreshing absence of cynicism in stuart little 2 -- quite a rarity, even in the family film market.",,1,1.3462910258610703
974,260,"... a cute and sometimes side-splittingly funny blend of legally blonde and drop dead gorgeous, starring piper perabo in what could be her breakthrough role.",,1,0.5437686831095855
984,80,"novak manages to capture a cruelly hilarious vein of black comedy in the situation with his cast of non-actors and a gritty, no-budget approach.",,1,1.5143545360760173
990,291,the way coppola professes his love for movies -- both colorful pop junk and the classics that unequivocally qualify as art -- is giddily entertaining.,,1,0.6381077454442314
999,360,"... a haunting vision, with images that seem more like disturbing hallucinations.",,-1,1.076578889680169
1029,230,genuinely touching because it's realistic about all kinds of love.,,1,0.5362389816851727
1059,194,"this is cool, slick stuff, ready to quench the thirst of an audience that misses the summer blockbusters.",,1,1.2761482456719757
1134,173,the film serves as a valuable time capsule to remind us of the devastating horror suffered by an entire people.,,0,1.367220282575169
1147,221,"not only is undercover brother as funny, if not more so, than both austin powers films, but it's also one of the smarter, savvier spoofs to come along in some time.",31.0,1,0.881711023414999
1151,286,"the inhospitability of the land emphasizes the spare precision of the narratives and helps to give them an atavistic power, as if they were tales that had been handed down since the beginning of time.",,0,1.1878616397821562
1175,9,"ultimately feels emp11111ty and unsatisfying, like swallowing a communion wafer without the wine.",,-1,0.6916897142424684
1183,60,one of the best films of the year with its exploration of the obstacles to happiness faced by five contemporary individuals... a psychological masterpiece.,,1,0.6438787092852585
1211,40,"beautifully observed, miraculously unsentimental comedy-drama.",,1,1.005531308764885
1228,282,the second coming of harry potter is a film far superior to its predecessor.,,1,1.030005299895917
1301,375,"warm water under a red bridge is a quirky and poignant japanese film that explores the fascinating connections between women, water, nature, and sexuality.",,1,0.5591688695810957
1330,185,"for the most part, it's a work of incendiary genius, steering clear of knee-jerk reactions and quick solutions.",,1,1.3827604629244816
1368,332,griffiths proves she's that rare luminary who continually raises the standard of her profession.,,1,0.9250454919529009
1371,384,"an important movie, a reminder of the power of film to move us and to make us examine our values.",,1,0.765280832572688
1381,103,"creepy, authentic and dark.",,0,1.2034618420766199
1389,139,and i've decided to leave a light on every night from now on.,,0,0.49985097840694503
1393,106,"the film is a contrivance, as artificial as the video games japanese teens play in a nightclub sequence, but it's an enjoyable one.",,0,0.9748480560071022
1465,84,but it's too long and too convoluted and it ends in a muddle.,12.0,-1,0.37203424620763453
1471,38,"the movie is for fans who can't stop loving anime, and the fanatical excess built into it.",,0,1.4724777924868286
1475,307,a strangely compelling and brilliantly acted psychological drama.,,1,0.4675286449951142
1489,159,"for those who pride themselves on sophisticated, discerning taste, this might not seem like the proper cup of tea, however it is almost guaranteed that even the stuffiest cinema goers will laugh their 1*** off for an hour-and-a-half.",,1,1.517760996441657
1523,262,few films capture so perfectly the hopes and dreams of little boys on baseball fields as well as the grown men who sit in the stands.,,1,1.2062352343044336
1527,198,"while it regards 1967 as the key turning point of the 20th century, and returns again and again to images of dissidents in the streets, it's alarmingly current.",,0,1.1459408686343466
1531,67,"stephen rea, aidan quinn, and alan bates play desmond's legal eagles, and when joined by brosnan, the sight of this grandiloquent quartet lolling in pretty irish settings is a pleasant enough thing, `tis.",,1,0.8682119331661263
1532,171,"director of photography benoit delhomme shot the movie in delicious colors, and the costumes and sets are grand.",,1,0.6151345179202911
1565,211,"more romantic, more emotional and ultimately more satisfying than the teary-eyed original.",,1,0.7962653129434569
1632,37,"featuring a dangerously seductive performance from the great daniel auteuil, ``sade'' covers the same period as kaufmann's ``quills'' with more unsettlingly realistic results.",,1,1.4966836626651654
1648,344,a thinly veiled look at different aspects of chinese life clashing with each other.,,0,1.1740135107433574
1656,226,"not the kind of film that will appeal to a mainstream american audience, but there is a certain charm about the film that makes it a suitable entry into the fest circuit.",,1,1.0360880682829583
1685,351,"shamelessly resorting to pee-related sight gags that might even cause tom green a grimace; still, myer's energy and the silliness of it all eventually prevail.",,0,1.3374258361570452
1688,24,"this version moves beyond the original's nostalgia for the communal film experiences of yesteryear to a deeper realization of cinema's inability to stand in for true, lived experience.",,0,1.4435169459774368
1691,158,allen's funniest and most likeable movie in years.,20.0,1,0.2922781947789241
1743,21,"but if you've paid a matinee price and bought a big tub of popcorn, there's guilty fun to be had here.",,0,1.3202652352713034
1770,252,the quirky drama touches the heart and the funnybone thanks to the energetic and always surprising performance by rachel griffiths.,,1,0.35137390586599127
1777,237,"measured against practically any like-themed film other than its oscar-sweeping franchise predecessor the silence of the lambs, red dragon rates as an exceptional thriller.",,1,0.6515030441633085
1784,303,a solid piece of journalistic work that draws a picture of a man for whom political expedience became a deadly foreign policy.,,0,1.4912464311581377
1827,98,"... creates a visceral sense of its characters' lives and conflicted emotions that carries it far above... what could have been a melodramatic, lifetime channel-style anthology.",,0,1.4887549184950883
1893,31,"same song, second verse, coulda been better, but it coulda been worse.",6.0,0,1.421609967893183
1936,272,the pianist is polanski's best film.,35.0,1,0.7914485088494169
1940,83,"high crimes knows the mistakes that bad movies make and is determined not to make them, and maybe that is nobility of a sort.",,0,1.4154414661546868
1954,116,"i thought the relationships were wonderful, the comedy was funny, and the love `real'.",,1,0.31576061993640653
1984,261,"this method almost never fails him, and it works superbly here.",,1,0.9898420194572745
2023,273,maybe thomas wolfe was right: you can't go home again.,,0,1.1868820266028417
2044,259,"the real charm of this trifle is the deadpan comic face of its star, jean reno, who resembles sly stallone in a hot sake half-sleep.",,0,1.2884720064848518
2081,281,"alain choquart's camera barely stops moving, portraying both the turmoil of the time and giving conduct a perpetual sense of urgency, which, for a film that takes nearly three hours to unspool, is both funny and irritating.",,0,1.5100527340299859
2082,35,mostly martha could have used a little trimming -- 10 or 15 minutes could be cut and no one would notice -- but it's a pleasurable trifle.,,0,1.334026427080091
2100,354,"bogdanovich taps deep into the hearst mystique, entertainingly reenacting a historic scandal.",,1,1.269502320094684
2109,244,"it would be disingenuous to call reno a great film, but you can say that about most of the flicks moving in and out of the multiplex.",,0,1.402369924775859
2130,318,"methodical, measured, and gently tedious in its comedy, secret ballot is a purposefully reductive movie -- which may be why it's so successful at lodging itself in the brain.",,1,1.2634191217510158
2146,114,"just about the best straight-up, old-school horror film of the last 15 years.",,1,0.5439627655310841
2223,263,steers has an unexpectedly adamant streak of warm-blooded empathy for all his disparate manhattan denizens -- especially the a**holes.,,0,1.5641448893620074
2254,107,"at its worst the screenplay is callow, but at its best it is a young artist's thoughtful consideration of fatherhood.",,0,1.434031930799702
2260,297,norton holds the film together.,,0,0.3692310149898962
2263,294,a creaky staircase gothic.,,0,1.0340811167387147
2268,176,isabelle huppert excels as the enigmatic mika and anna mouglalis is a stunning new young talent in one of chabrol's most intense psychological mysteries.,,1,0.5222082070711576
2270,390,wedding feels a bit anachronistic.,,-1,0.6392140238459065
2295,284,"the film just might turn on many people to opera, in general, an art form at once visceral and spiritual, wonderfully vulgar and sublimely lofty -- and as emotionally grand as life.",,1,1.0496427949193852
2345,243,"pacino and williams seem to keep upping the ante on each other, just as their characters do in the film.",,1,0.9993048488730478
2347,164,the cast is top-notch and i predict there will be plenty of female audience members drooling over michael idemoto as michael.,,1,1.2716641420160295
2361,127,the simplicity of the way home has few equals this side of aesop.,,0,1.4372043227775175
2366,10,exudes the fizz of a busby berkeley musical and the visceral excitement of a sports extravaganza.,,1,1.000431249244874
2384,380,"but the talented cast alone will keep you watching, as will the fight scenes.",40.0,1,0.8946577053893003
2401,88,"one of the finest, most humane and important holocaust movies ever made.",,1,0.3828200091695074
2407,265,the most compelling performance of the year adds substantial depth to this shocking testament to anti-semitism and neo-fascism.,,1,1.3199692531291685
2436,120,"ultimate x is a ride, basically the kind of greatest-hits reel that might come with a subscription to espn the magazine.",,0,0.7477372263234745
2456,268,"a work of extraordinary journalism, but it is also a work of deft and subtle poetry.",33.0,1,1.1137961073095317
2458,108,at 78 minutes it just zings along with vibrance and warmth.,,1,1.1958270162568672
2486,95,"... a solid, well-formed satire.",,1,1.0398217256418645
2520,179,photographed with melancholy richness and eloquently performed yet also decidedly uncinematic.,,0,1.3955858111385993
2561,39,"the ring is worth a look, if you don't demand much more than a few cheap thrills from your halloween entertainment.",,0,1.0806110229296475
2564,232,"armed with a game supporting cast, from the pitch-perfect forster to the always hilarious meara and levy, like mike shoots and scores, doing its namesake proud.",,1,0.7169605009949478
2581,289,"hard, endearing, caring, warm.",,1,1.3889456469801116
2594,357,"devos and cassel have tremendous chemistry -- their sexual and romantic tension, while never really vocalized, is palpable.",,1,0.858796570961991
2643,197,"for veggietales fans, this is more appetizing than a side dish of asparagus.",,1,0.7221849039715328
2703,209,"denis forges out of the theories of class - based rage and sisterly obsession a razor-sided tuning fork that rings with cultural, sexual and social discord.",,0,1.1301960289305073
2742,199,a truly wonderful tale combined with stunning animation.,29.0,1,0.1448899121538357
2817,204,a portrait of an artist.,,0,0.3886567993701522
2871,203,"while tattoo borrows heavily from both seven and the silence of the lambs, it manages to maintain both a level of sophisticated intrigue and human-scale characters that suck the audience in.",,1,1.433474793002232
2925,285,"the delicious trimmings... arrive early and stay late, filling nearly every minute... with a lighthearted glow, some impudent snickers, and a glorious dose of humankind's liberating ability to triumph over a scrooge or two.",,1,0.8889902751040928
2953,168,it's anchored by splendid performances from an honored screen veteran and a sparkling newcomer who instantly transform themselves into a believable mother/daughter pair.,,1,0.3144215630167887
2969,393,"every individual will see the movie through the prism of his or her own beliefs and prejudices, but the one thing most will take away is the sense that peace is possible.",,1,1.4558138774967786
2974,247,narc is a no-bull throwback to 1970s action films.,,1,0.9572637758609598
2986,191,audiard successfully maintains suspense on different levels throughout a film that is both gripping and compelling.,,1,0.519060193634102
3002,238,"the movie has no respect for laws, political correctness or common decency, but it displays something more important: respect for its flawed, crazy people.",,0,1.5258894124693858
3043,348,"the climactic events are so well realized that you may forget all about the original conflict, just like the movie does.",,0,1.328042978673923
3089,115,"gosling creates a staggeringly compelling character, a young man whose sharp intellect is at the very root of his contradictory, self-hating, self-destructive ways.",,1,1.5361106853754645
3172,267,a biopic about crane's life in the classic tradition but evolves into what has become of us all in the era of video.,,0,0.5480995932192754
3174,138,"thanks to a small star with big heart, this family film sequel is plenty of fun for all.",,1,0.34261506593369334
3188,146,"the fun of the movie is the chance it affords to watch jackson, who also served as executive producer, take his smooth, shrewd, powerful act abroad.",,1,0.8755110488513947
3229,401,"it's a head-turner -- thoughtfully written, beautifully read and, finally, deeply humanizing.",45.0,1,0.6195782486489471
3273,30,it's all a rather shapeless good time...,,0,1.2846115119209345
3422,77,"whatever heartwarming scene the impressively discreet filmmakers may have expected to record with their mini dv, they show a remarkable ability to document both sides of this emotional car-wreck.",,1,0.8707192682330552
3440,241,the film is darkly funny in its observation of just how much more grueling and time-consuming the illusion of work is than actual work.,,1,0.9350060391602714
3545,135,"a fiercely clever and subtle film, capturing the precarious balance between the extravagant confidence of the exiled aristocracy and the cruel earnestness of the victorious revolutionaries.",,1,1.3578850642863358
3570,329,"this is an extraordinary film, not least because it is japanese and yet feels universal.",,1,0.7050707384015238
3576,63,"qutting may be a flawed film, but it is nothing if not sincere.",,0,1.2823927637421533
3577,6,"beautifully crafted, engaging filmmaking that should attract upscale audiences hungry for quality and a nostalgic, twisty yarn that will keep them guessing.",,1,0.8747679118170165
3600,372,"while this gentle and affecting melodrama will have luvvies in raptures, it's far too slight and introspective to appeal to anything wider than a niche audience.",,0,1.533390779752069
3611,373,griffin & co. manage to be spectacularly outrageous.,,1,1.2149702331417556
3712,68,"it's a powerful though flawed movie, guaranteed to put a lump in your throat while reaffirming washington as possibly the best actor working in movies today.",,1,1.347107771470018
3731,54,it depends on how well flatulence gags fit into your holiday concept.,,0,0.9023806723176202
3744,32,i love the robust middle of this picture.,,1,0.1956414442287509
3755,306,samuel beckett applied to the iranian voting process.,,0,0.34201488947784486
3798,41,"what makes how i killed my father compelling, besides its terrific performances, is fontaine's willingness to wander into the dark areas of parent-child relationships without flinching.",,1,1.1614377093556418
3804,399,its engaging simplicity is driven by appealing leads.,,1,0.4604032317872172
3811,358,"as a girl-meets-girl romantic comedy, kissing jessica steinis quirky, charming and often hilarious.",,1,0.37850156780200506
3842,212,"like the best of godard's movies... it is visually ravishing, penetrating, impenetrable.",,1,0.6474343646005216
3850,92,features one of the most affecting depictions of a love affair ever committed to film.,,1,1.521320005418612
3906,333,"the asylum material is gripping, as are the scenes of jia with his family.",,1,1.1498471105833936
3911,12,"ryan gosling is, in a word, brilliant as the conflicted daniel.",,1,1.2655656372164343
3936,309,"this enthralling documentary... is at once playful and haunting, an in-depth portrait of an iconoclastic artist who was fundamentally unknowable even to his closest friends.",,1,1.336040859869647
3956,129,"dong shows how intolerance has the power to deform families, then tear them apart.",,0,1.0532501310212325
3974,91,"angel presents events partly from the perspective of aurelie and christelle, and infuses the film with the sensibility of a particularly nightmarish fairytale.",,1,1.2113364977030008
3981,100,just how these families interact may surprise you.,,0,1.0993196396558056
4010,190,"a colorful, vibrant introduction to a universal human impulse, lushly photographed and beautifully recorded.",26.0,1,0.3989557224430952
4033,79,"it has fun with the quirks of family life, but it also treats the subject with fondness and respect.",,1,0.8291337772631027
4062,367,"this odd, poetic road movie, spiked by jolts of pop music, pretty much takes place in morton's ever-watchful gaze -- and it's a tribute to the actress, and to her inventive director, that the journey is such a mesmerizing one.",,1,1.2235650661186244
4067,26,"a first-class, thoroughly involving b movie that effectively combines two surefire, beloved genres -- the prison flick and the fight film.",,1,0.6999361963600147
4077,339,`enigma' is the kind of engaging historical drama that hollywood appears to have given up on in favor of sentimental war movies in the vein of `we were soldiers.',,0,1.3138399634350688
4146,57,"sparkling, often hilarious romantic jealousy comedy... attal looks so much like a young robert deniro that it seems the film should instead be called `my husband is travis bickle'.",,1,0.9868801342441151
4173,216,"in xxx, diesel is that rare creature -- an action hero with table manners, and one who proves that elegance is more than tattoo deep.",,1,1.078707518949898
4202,184,"impresses as a skillfully assembled, highly polished and professional adaptation... just about as chilling and unsettling as `manhunter' was.",,1,1.355052682009276
4212,134,"a miraculous movie, i'm going home is so slight, yet overflows with wisdom and emotion.",17.0,1,1.4198536810625721
4232,22,"there's not much to fatale, outside of its stylish surprises... but that's ok.",4.0,0,1.3425516070833603
4282,177,a small movie with a big impact.,23.0,1,1.12751060582861
4285,277,"like rudy yellow lodge, eyre needs to take a good sweat to clarify his cinematic vision before his next creation and remember the lessons of the trickster spider.",,-1,1.2485515655492276
4317,155,the immersive powers of the giant screen and its hyper-realistic images are put to perfect use in the breathtakingly beautiful outer-space documentary space station 3d.,,1,0.30599955110620564
4335,242,"in some ways, lagaan is quintessential bollywood.",,0,1.320276758108911
4465,202,"it's a hoot watching the rock chomp on jumbo ants, pull an arrow out of his back, and leap unscathed through raging fire!",,1,1.5193375614021163
4466,325,returning director rob minkoff... and screenwriter bruce joel rubin... have done a fine job of updating white's dry wit to a new age.,,1,0.6487516657148052
4468,61,"a strong script, powerful direction and splendid production design allows us to be transported into the life of wladyslaw szpilman, who is not only a pianist, but a good human being.",10.0,1,0.38166338284679235
4537,34,the soundtrack alone is worth the price of admission.,7.0,1,0.9557189416995846
4591,353,"most haunting about ``fence'' is its conclusion, when we hear the ultimate fate of these girls and realize, much to our dismay, that this really did happen.",,1,1.0570368450279297
4596,391,"an action/thriller of the finest kind, evoking memories of day of the jackal, the french connection, and heat.",,1,0.8554074808440885
4649,248,intriguing and downright intoxicating.,,1,0.8014046704991903
4672,334,"... by the time it's done with us, mira nair's new movie has its audience giddy with the delight of discovery, of having been immersed in a foreign culture only to find that human nature is pretty much the same all over.",,1,1.0569341713853646
4704,166,this is one of those war movies that focuses on human interaction rather than battle and action sequences... and it's all the stronger because of it.,,1,1.2527676342438039
4786,311,"at its best when the guarded, resentful betty and the manipulative yet needy margot are front and center.",,0,1.480243325121237
4801,97,read my lips is to be viewed and treasured for its extraordinary intelligence and originality as well as its lyrical variations on the game of love.,,1,0.45130930515754447
4806,224,it's a funny little movie with clever dialogue and likeable characters.,,1,0.21305056004498957
4864,346,its vision of that awkward age when sex threatens to overwhelm everything else is acute enough to make everyone who has been there squirm with recognition.,,0,1.3791252656331943
4956,201,``simone'' is a fun and funky look into an artificial creation in a world that thrives on artificiality.,,1,0.4017162589677568
5032,405,martyr gets royally screwed and comes back for more.,,0,0.4022192652258678
5047,110,"as quiet, patient and tenacious as mr. lopez himself, who approaches his difficult, endless work with remarkable serenity and discipline.",,1,1.283349675211554
5053,113,jeffs has created a breathtakingly assured and stylish work of spare dialogue and acute expressiveness.,,1,0.28977969532068326
5137,389,but what's nice is that there's a casual intelligence that permeates the script.,42.0,1,0.8385748508735419
5209,128,exceptionally well acted by diane lane and richard gere.,15.0,1,0.5291078070584717
